booth_id,booth_area,main_category,assigned_team,table_count,estimated_items,actual_items,notes,sale_records,quantity_sold,booth_revenue_cny,item_count_difference,revenue_per_actual_item_cny
B005,Shared Table,Handmade Crafts Accessories and Snacks,Team A,4,415,415,used shared table for small fast-moving items,13,337,1895.0,0,4.57
B001,Booth A,Books and Stationery,Team A,3,135,135,placed lower-priced books near notebooks,8,104,1155.0,0,8.56
B004,Booth D,Electronics and Household Items,Team D,2,55,55,fragile items were placed at the back,6,36,949.0,0,17.25
B003,Booth C,Toys,Team C,2,29,29,small toys were grouped in baskets,4,26,652.0,0,22.48
B002,Booth B,Clothes,Team B,2,41,41,kept clothes on one side for easier browsing,4,31,618.0,0,15.07
